{
  "candidate_version": 1,
  "generated_on": "2026-10-01",
  "scope": "United States federal and state legislative video, webcast, and schedule candidates for possible catalogue inclusion.",
  "method": "Record every federal legislative surface and all 50 official state legislature roots. Mark a candidate verified only when an official legislature or legislature-authorized provider currently documents live or archived legislative video. This inventory does not assert a stable direct stream or redistribution permission.",
  "authoritative_directory_url": "https://www.congress.gov/state-legislature-websites",
  "federal_candidates": [
    {
      "id": "us-house-floorcast",
      "institution": "U.S. House of Representatives",
      "candidate_type": "floor_channel",
      "official_url": "https://www.house.gov/watch-houselive",
      "video_url": "https://live.house.gov/",
      "schedule_url": "https://live.house.gov/",
      "research_status": "existing_fallback",
      "priority": "high",
      "evidence_urls": ["https://www.house.gov/watch-houselive", "https://live.house.gov/"],
      "notes": "Existing fallback. Separate the stable floor service, event pages, schedule semantics, and House-specific reuse restrictions before catalogue promotion."
    },
    {
      "id": "us-senate-floor-webcast",
      "institution": "U.S. Senate",
      "candidate_type": "floor_channel",
      "official_url": "https://www.senate.gov/floor/",
      "video_url": "https://www.senate.gov/floor/",
      "schedule_url": "https://www.senate.gov/legislative/schedule/floor_schedule.htm",
      "research_status": "verified_official_video_surface",
      "priority": "high",
      "evidence_urls": ["https://www.senate.gov/floor/", "https://www.senate.gov/visiting/common/generic/new/watching_congress.htm"],
      "notes": "Official floor webcast and schedule. Discover the supported player route and document Senate-specific reuse terms before promotion."
    },
    {
      "id": "us-house-committee-video",
      "institution": "U.S. House of Representatives",
      "candidate_type": "committee_platform",
      "official_url": "https://www.congress.gov/committees/video",
      "video_url": "https://www.congress.gov/committees/video",
      "schedule_url": "https://www.congress.gov/committee-schedule/weekly/2026/08/24",
      "research_status": "verified_official_video_surface",
      "priority": "high",
      "evidence_urls": ["https://www.congress.gov/committees/video", "https://www.congress.gov/committees"],
      "notes": "Official live and archived House committee video index. Treat individual meetings as event records rather than permanent channels."
    },
    {
      "id": "us-congress-committee-meetings-api",
      "institution": "United States Congress",
      "candidate_type": "committee_platform",
      "official_url": "https://api.congress.gov/",
      "video_url": "https://www.congress.gov/video",
      "schedule_url": "https://api.congress.gov/",
      "research_status": "verified_official_video_surface",
      "priority": "high",
      "evidence_urls": ["https://api.congress.gov/", "https://www.congress.gov/video"],
      "notes": "The official API exposes committee-meeting metadata and requires an API key. Evaluate it as schedule enrichment, not as a video transport."
    },
    {
      "id": "us-senate-committee-webcasts",
      "institution": "U.S. Senate",
      "candidate_type": "committee_platform",
      "official_url": "https://www.senate.gov/committees/hearings_meetings.htm",
      "video_url": "https://www.senate.gov/committees/hearings_meetings.htm",
      "schedule_url": "https://www.senate.gov/committees/hearings_meetings.htm",
      "research_status": "verified_official_video_surface",
      "priority": "medium",
      "evidence_urls": ["https://www.senate.gov/committees/hearings_meetings.htm", "https://www.senate.gov/committees/how_to_committee_hearings.htm"],
      "notes": "Senate committee webcasts are distributed across committee sites. Inventory event identity, player vendors, schedules, and archives by committee."
    },
    {
      "id": "us-cspan-congress",
      "institution": "United States Congress",
      "candidate_type": "broadcaster_fallback",
      "official_url": "https://www.c-span.org/congress/",
      "video_url": "https://www.c-span.org/congress/",
      "schedule_url": "https://www.c-span.org/schedule/",
      "research_status": "existing_fallback",
      "priority": "medium",
      "evidence_urls": ["https://www.c-span.org/congress/", "https://www.c-span.org/about/copyrightsAndLicensing/"],
      "notes": "Existing broadcaster fallback. Keep separate from first-party congressional services and preserve C-SPAN's source-specific licensing posture."
    }
  ],
  "state_candidates": [
    {
      "id": "us-al-legislature", "state": "Alabama", "postal_code": "AL", "institution": "Alabama Legislature", "candidate_type": "legislature_platform", "official_url": "https://www.legislature.state.al.us/", "video_url": null, "schedule_url": null, "research_status": "official_root_recorded", "priority": "research", "evidence_urls": ["https://www.legislature.state.al.us/"], "notes": "Locate current House, Senate, and committee video and schedule surfaces."
    },
    {
      "id": "us-ak-legislature", "state": "Alaska", "postal_code": "AK", "institution": "Alaska State Legislature", "candidate_type": "legislature_platform", "official_url": "https://akleg.gov/", "video_url": null, "schedule_url": null, "research_status": "official_root_recorded", "priority": "research", "evidence_urls": ["https://akleg.gov/"], "notes": "Research the legislature's current relationship with Gavel Alaska and identify official event metadata."
    },
    {
      "id": "us-az-legislature", "state": "Arizona", "postal_code": "AZ", "institution": "Arizona State Legislature", "candidate_type": "legislature_platform", "official_url": "https://www.azleg.gov/", "video_url": null, "schedule_url": null, "research_status": "official_root_recorded", "priority": "research", "evidence_urls": ["https://www.azleg.gov/"], "notes": "Locate current chamber and committee video and schedule surfaces."
    },
    {
      "id": "us-ar-legislature", "state": "Arkansas", "postal_code": "AR", "institution": "Arkansas General Assembly", "candidate_type": "legislature_platform", "official_url": "https://www.arkleg.state.ar.us/", "video_url": null, "schedule_url": null, "research_status": "official_root_recorded", "priority": "research", "evidence_urls": ["https://www.arkleg.state.ar.us/"], "notes": "Locate current chamber and committee video and schedule surfaces."
    },
    {
      "id": "us-ca-legislature", "state": "California", "postal_code": "CA", "institution": "California State Legislature", "candidate_type": "legislature_platform", "official_url": "https://leginfo.legislature.ca.gov/", "video_url": "https://www.assembly.ca.gov/todaysevents", "schedule_url": "https://www.assembly.ca.gov/events", "research_status": "verified_official_video_surface", "priority": "high", "evidence_urls": ["https://www.assembly.ca.gov/todaysevents", "https://www.assembly.ca.gov/events/past"], "notes": "Assembly live room feeds and event archives are verified. Research Senate coverage separately and identify stable event/player metadata."
    },
    {
      "id": "us-co-legislature", "state": "Colorado", "postal_code": "CO", "institution": "Colorado General Assembly", "candidate_type": "legislature_platform", "official_url": "https://leg.colorado.gov/", "video_url": null, "schedule_url": null, "research_status": "official_root_recorded", "priority": "research", "evidence_urls": ["https://leg.colorado.gov/"], "notes": "Official materials reference Colorado Channel floor video and legislative audio; verify current public surfaces and rights."
    },
    {
      "id": "us-ct-legislature", "state": "Connecticut", "postal_code": "CT", "institution": "Connecticut General Assembly", "candidate_type": "legislature_platform", "official_url": "https://www.cga.ct.gov/", "video_url": null, "schedule_url": null, "research_status": "official_root_recorded", "priority": "research", "evidence_urls": ["https://www.cga.ct.gov/"], "notes": "Research first-party feeds and the legislature's current relationship with CT-N."
    },
    {
      "id": "us-de-legislature", "state": "Delaware", "postal_code": "DE", "institution": "Delaware General Assembly", "candidate_type": "legislature_platform", "official_url": "https://legis.delaware.gov/", "video_url": null, "schedule_url": null, "research_status": "official_root_recorded", "priority": "research", "evidence_urls": ["https://legis.delaware.gov/"], "notes": "Locate current chamber and committee video and schedule surfaces."
    },
    {
      "id": "us-fl-legislature", "state": "Florida", "postal_code": "FL", "institution": "Florida Legislature", "candidate_type": "legislature_platform", "official_url": "https://www.leg.state.fl.us/", "video_url": "https://www.flsenate.gov/Media/Videos", "schedule_url": "https://www.flsenate.gov/Media/VideoSchedule/Active", "research_status": "verified_official_video_surface", "priority": "high", "evidence_urls": ["https://www.flsenate.gov/Media/Videos", "https://www.flsenate.gov/Media/VideoSchedule/Active"], "notes": "The official Senate site exposes live schedules and archives, including House and joint events. Record the explicit nonpolitical and noncommercial use restriction."
    },
    {
      "id": "us-ga-legislature", "state": "Georgia", "postal_code": "GA", "institution": "Georgia General Assembly", "candidate_type": "legislature_platform", "official_url": "https://www.legis.ga.gov/", "video_url": null, "schedule_url": null, "research_status": "official_root_recorded", "priority": "research", "evidence_urls": ["https://www.legis.ga.gov/"], "notes": "Locate current chamber and committee video and schedule surfaces."
    },
    {